{
  "schema_version": "0.3.0",
  "deletion_case_id": "deletion-case.001",
  "version": 1,
  "mission_id": "mission.sentinel-fixture",
  "trigger": {
    "kind": "scheduled_expiry",
    "request_ref": null,
    "schedule_ref": {
      "id": "retention-schedule.001",
      "version": 1,
      "digest": "sha256:aaaaaaaaaaaaaaaaaaaaaaaaaaaaaaaaaaaaaaaaaaaaaaaaaaaaaaaaaaaaaaaa"
    },
    "rights_revocation_ref": null
  },
  "scope": {
    "asset_refs": [
      {
        "id": "data-asset.001",
        "version": 1,
        "digest": "sha256:bbbbbbbbbbbbbbbbbbbbbbbbbbbbbbbbbbbbbbbbbbbbbbbbbbbbbbbbbbbbbbbb"
      }
    ],
    "representation_planes": [
      "primary_artifact"
    ],
    "scope_manifest_digest": "sha256:cccccccccccccccccccccccccccccccccccccccccccccccccccccccccccccccc"
  },
  "dependency_discovery": {
    "lineage_graph_digest": "sha256:dddddddddddddddddddddddddddddddddddddddddddddddddddddddddddddddd",
    "ledger_position": 200,
    "disposition": "complete",
    "unresolved_planes": []
  },
  "legal_hold_refs": [],
  "hold_authority_effect": "no_new_access_processing_or_disclosure",
  "authorization_ref": {
    "artifact_id": "deletion-authorization.001",
    "digest": "sha256:eeeeeeeeeeeeeeeeeeeeeeeeeeeeeeeeeeeeeeeeeeeeeeeeeeeeeeeeeeeeeeee",
    "media_type": "application/json"
  },
  "plane_results": [
    {
      "plane": "primary_artifact",
      "status": "verified",
      "method_profile_ref": {
        "id": "method.object-delete",
        "version": "0.1.0",
        "digest": "sha256:ffffffffffffffffffffffffffffffffffffffffffffffffffffffffffffffff"
      },
      "execution_evidence_ref": {
        "artifact_id": "deletion-execution.001",
        "digest": "sha256:1111111111111111111111111111111111111111111111111111111111111111",
        "media_type": "application/json"
      },
      "verification_evidence_ref": {
        "artifact_id": "deletion-verification.001",
        "digest": "sha256:2222222222222222222222222222222222222222222222222222222222222222",
        "media_type": "application/json"
      },
      "residual_description": null
    }
  ],
  "provider_result": {
    "status": "not_applicable",
    "request_evidence_ref": null,
    "receipt_evidence_ref": null,
    "declared_residual_limit": null
  },
  "affected_scientific_objects": [
    {
      "object_ref": {
        "id": "artifact-manifest.001",
        "version": 1,
        "digest": "sha256:3333333333333333333333333333333333333333333333333333333333333333"
      },
      "consequence": "artifact_unavailable",
      "correction_or_invalidation_ref": {
        "artifact_id": "invalidation.001",
        "digest": "sha256:4444444444444444444444444444444444444444444444444444444444444444",
        "media_type": "application/json"
      }
    }
  ],
  "residual_copies": [],
  "limitations": [
    "Completion is bounded to the declared primary-artifact plane."
  ],
  "closure_verification": {
    "disposition": "pass",
    "rule_ref": {
      "id": "rule.deletion-closure",
      "version": "0.1.0",
      "digest": "sha256:5555555555555555555555555555555555555555555555555555555555555555"
    },
    "result_ref": {
      "id": "validation.deletion-closure.001",
      "version": 1,
      "digest": "sha256:6666666666666666666666666666666666666666666666666666666666666666"
    }
  },
  "status": "completed",
  "opened_at": "2026-07-15T18:00:00.000000Z",
  "closed_at": "2026-07-15T18:10:00.000000Z",
  "case_owner": {
    "principal_id": "data-rights-authority.001",
    "principal_type": "human"
  }
}
